<?xml version="1.0" encoding="utf-8"?>
<xs:schema xmlns:xs="http://www.w3.org/2001/XMLSchema">
<xs:element name="table">
    <xs:complexType>
      <xs:sequence>
        <xs:element name="head">
          <xs:complexType>
            <xs:sequence>
              <xs:element name="hobl" type="xs:string" />
              <xs:element name="hpopulation" type="xs:string" />
            </xs:sequence>
          </xs:complexType>
        </xs:element>
        <xs:element maxOccurs="unbounded" name="string">
          <xs:complexType>
            <xs:sequence>
              <xs:element name="obl" type="xs:string" />
              <xs:element name="population" type="xs:string" />
            </xs:sequence>
          </xs:complexType>
        </xs:element>
      </xs:sequence>
    </xs:complexType>
  </xs:element>
</xs:schema>